id,New_Categories,New Report Name,short_description,long_description
260,Metering&Consumption,Routes,Creates a report for manually recording meter readings.,"Creates a report for manually recording meter readings. Shows account and meter information for each meter with an empty column for writing new end readings. By default, it includes all active meters belonging to active parcels regardless of an active customer being present."
413,Metering&Consumption,Routes (3 Decimal Places),Creates a report for manually recording meter readings.,"Creates a report for manually recording meter readings. Shows account and meter information for each meter with an empty column for writing new end readings. By default, it includes all active meters belonging to active parcels regardless of an active customer being present."
396,Metering&Consumption,Unposted Meter Readings,Unposted Meter Readings,Unposted Meter Readings
380,Metering&Consumption,Zero Consumption Meters,Zero Usage Report,Zero Usage Report
117,Payments,Cash Deposited,Scvwd Cash Deposited,Scvwd Cash Deposited
116,Payments,Cash Receipts Applied Details,Scvwd Cash Receipts Applied Details,Scvwd Cash Receipts Applied Details
169,Payments,Auto Pay Customers,"A list of all auto pay customers with active, pending, or canceled statuses of enrollment.","Shows a list of all auto pay customers with active, pending, or canceled statuses of enrollment."
385,Payments,Payment Allocation Changes,Payment Allocation Changes,Payment Allocation Changes
183,Payments,Batch Transaction,SUMI - Batch Transaction,SUMI - Batch Transaction
162,Payments,Payment Allocation Changes,Payment Allocation Changes,Payment Allocation Changes
153,Payments,Payments by Payment Type,Nitor Payments by Payment Type,Payments grouped by Payment Type.
218,Payments,Payments Detail,Payments Detail,Payments Detail
163,Payments,Unallocated Payments,Invoices Summary,Invoices Summary
232,Payments,Cash Receipts,"Payments, both posted and unposted.","Payments, both posted and unposted, by account category and then by account type and billing type. Detail report shows payments per customer, per billing type. Summary report shows amounts per billing type."
354,Payments,IVR Payments By Date,IVR Payments in a selected date range.,"All IVR payments within a selected date range. Summary includes sections showing payments by Payment Date, by Billing Type, and by Payment Type (Billing Type per Payment Type). Detail displays payments per customer, grouped and ordered by Payment Date."
245,Payments,Online Payment Deposit Reconciliation,Online credit card payment batches processed within a given date range.,"Shows online credit card payment batches processed within the given date range. ""Summary"" shows amounts grouped by billing type and sorted by batch ID. ""Deposits"" shows a total amount grouped by batch ID. ""Detail"" shows each customer's deposit amount, fee amount, and total payment, sorted by batch ID and customer account number."
244,Payments,Online Payments,"Online payments within a selected date range, sorted by date and account number.","All online payments within a selected date range based on payment date, sorted by date and account number. NOTE: Applied Amount column is only available for payments made after 10/1/2015."
151,Payments,Online Payments - Nitor,Nitor Online Payments,Nitor Online Payments
248,Payments,Overpayments,Payments not currently applied to a bill.,Shows non-deposit payments that are not currently applied to a bill on a customer account. Summary shows the sum of all overpayments by billing type. Detail shows each customer with an overpayment and can be grouped by billing type if desired
251,Payments,Payment Reconciliation Batches,Batches of payments posted in Reconcile Payments within a chosen date range.,All batches of payments posted in Reconcile Payments within a chosen date range. Grouped by batch date and Received By.
352,Payments,Payment Reconciliation Batches Alt,Alternate view of Payment Reconciliation Batches,"
Alternate view of Payment Reconciliation Batches
"
124,Payments,Payments,Payments,Payments
252,Payments,Payments by Billing Type,Payments in a specified date range grouped by billing type.,"All payments in a specified date range grouped by billing type. Summary shows payment amounts by account type, then account category, then billing type. Detail displays payments for each customer grouped by account type, then account category, then billing type."
253,Payments,Payments by Date,Payments in a selected date range.,"All payments in a selected date range. Summary includes sections showing payments by Payment Date, by Billing Type, and by Payment Type (Billing Type per Payment Type). Detail displays payments per customer, grouped and ordered by Payment Date."
254,Payments,Payments by Payment Type,Payments within a selected date range grouped by payment type.,All payments within a selected date range grouped by payment type. Summary shows payments by payment type and billing type. Detail lists individual payments by payment type ordered by date then account number.
331,Payments,Payments by Payment Type With Deposits,"Payments within a selected date range grouped by payment type, with deposits section.",All payments within a selected date range grouped by payment type. Summary shows payments by payment type and billing type. Detail lists individual payments by payment type ordered by date then account number. Includes a deposits section post-summary.
258,Payments,Returned Payments,Returned payments within a date range.,Shows returned payments within a selected date range. Also displays any returned payment fees applied to customers. Bill Date signifies the day the payment was returned in the system and corresponding debits created.
203,Payments,Unapplied Payments,Payments that have not been applied or that are applied to an unposted bill.,Payments that have not been applied or that are applied to an unposted bill.
